original_category,narrative
credit_reporting,true identity theft victim identity theft information listed appears credit report relate transaction made result identity theft please block information report date open date open date open transunion number report number lock seeing report please help get life back called company give personal information could find system understand address fraud please assist communicating creditor validate identity theft personal information exposed breach started receiving information checked online found data breach looked credit report found inaccurate false fraudulent information belong contacted local police made report also told make report ftc jurisdiction ive listed many fraudulent account could thank help also file ftc able find job subjected adverse action pertaining cra reporting inaccurate information result fraud victim identify theft placing fraud alert credit report
credit_reporting,true identity theft victim identity theft information listed appears credit report relate transaction made result identity theft please block information reporting credit report confirmation account name account number date open account name account number date open account name account number date open account name account number date open date open mail account name account number date account name account number date open personal information exposed data breach started receiving information checked online found data breach looked credit report found inaccurate false fraudulent information belong contacted local police made report also told make report ftc jurisdiction ive listed many fraudulent account could thank help
credit_reporting,true identity theft victim identity theft information listed appears credit report relate transaction made result identity theft please block information report file number experian report number report confirmation number account name account number date open account name account number date open recently found involved breach scared news eligible file clam lost process long time consuming complicated dont history credit finance referred attorney specializes predatory loan breach victim compensation carefully reviewing credit file ive noticed account called disputed experian problem never got solve reaching guy help fraudulent debt hindering ability apply credit even get first time credit card people trying build credit know start next step take remedy situation caused financial emotional stress worst part denied job based negative information report subjected adverse action pertaining cra reporting inaccurate information result fraud victim identify theft placing fraud alert credit report
credit_reporting,true identity theft im member equifax data breach filed claim accordingly attempting clear credit report fraudulent item file number report number report number equifax block seeing credit report list account account number recently found involved equifax breach scared news eligible file clam lost process long time consuming complicated dont history credit finance referred attorney specializes predatory loan breach victim compensation carefully reviewing credit file ive noticed account credit file please help removing item know start next step take remedy situation caused financial emotional stress worst part denied job based negative information report subjected adverse action pertaining cra reporting inaccurate information result fraud victim identify theft placing fraud alert credit report
credit_reporting,true identity theft im member data breach filed claim accordingly attempting clear credit report fraudulent item transunion file number report number report number block seeing credit report list account account number recently found involved breach scared news eligible file clam lost process long time consuming complicated dont history credit finance referred attorney specializes predatory loan breach victim compensation carefully reviewing credit file ive noticed account credit file please help removing item know start next step take remedy situation caused financial emotional stress worst part denied job based negative information report subjected adverse action pertaining cra reporting inaccurate information result fraud victim identify theft placing fraud alert credit report
credit_reporting,true identity theft im member data breach filed claim accordingly attempting clear credit report fraudulent item file number report number experian report number block seeing credit report list account account number recently found involved breach scared news eligible file clam lost process long time consuming complicated dont history credit finance referred attorney specializes predatory loan breach victim compensation carefully reviewing credit file ive noticed account credit file please help removing item know start next step take remedy situation caused financial emotional stress worst part denied job based negative information report subjected adverse action pertaining cra reporting inaccurate information result fraud victim identify theft placing fraud alert credit report
credit_reporting,true identity theft report number experian report number file number victim data breach ive filed claim accordingly ive attempting clear credit report fraudulent item far back ive unsuccessful
credit_reporting,true identity theft report number report number transunion file number victim data breach ive filed claim accordingly ive attempting clear credit report fraudulent item far back ive unsuccessful
credit_reporting,true identity theft report number report number xxxxxxxx file number victim equifax data breach ive filed claim accordingly ive attempting clear credit report fraudulent item far back ive unsuccessful
credit_reporting,true identity theft transunion file report report account name account account name account account name u dept ed account number account name dpt edxxxx account number account name original creditor account account name original creditor account account name original creditor account account original creditor account ive trying reach transunion right back saying verified please help thank
credit_reporting,true identity theft file report confirmation experian report number account name account account name account account name u dept ed account number account name dpt account number account name original creditor account account name original creditor account account name original creditor account account name original creditor account ive trying reach experian right back saying verified please help thank
credit_reporting,true identity theft file numberxxxx equifax report confirmation report number account name account account name account account name u dept ed account number account dpt edxxxx account number account name original creditor account account name original creditor account account name original creditor xxxxxxxx account account name original creditor account ive trying reach equifax right back saying verified please help thank
debt_collection,new posting three credit bureau medical bill subsidy medical bill filed bankruptcy wisconsin law medical bill go collection credit file anyway
retail_banking,fraudulent charge totaling made capital one checking account via debit card seeing charge immediately canceled debit card informed capital one fraudulent charge disputed charge posted account issued provisional credit pending determination claim received form letter bank denying claim money withdrawn account opened appeal denial capital one bank person every contacted discus original claim make determination furthermore never lost possession debit card authorized person use capital one sent new debit card authorized via usps replace debit card set expire card sent fraudulent charge occurred never received card believe card intercepted fraudulently activated used make fraudulent purchase complained activated card several time capital one complained fraudulent charge last call dispute denial claim never noted account asked several time person making determination claim contact person making complaint malfeasance gross business practice sending replacement card without authorization letting said card activated use credit purchase without authorization fraud reported claim made contacting discus complaint making determination appealed denial capital one bank claim number also made complaint local police dept division financial service regard fraudulent charge
credit_reporting,block except otherwise provided section consumer reporting agency shall block reporting information file consumer consumer identifies information resulted alleged identity theft later business day date receipt agency appropriate proof identity consumer copy identity theft report identification information consumer statement consumer information information relating transaction consumer b notification consumer reporting agency shall promptly notify furnisher information identified consumer subsection section information may result identity theft identity theft report filed block requested section effective date block c authority decline rescind general consumer reporting agency may decline block may rescind block information relating consumer section consumer reporting agency reasonably determines information blocked error block requested consumer error b information blocked block requested consumer basis material misrepresentation fact consumer relevant request block c consumer obtained possession good service money result blocked transaction transaction notification consumer block information declined rescinded subsection affected consumer shall notified promptly manner consumer notified reinsertion information section b title significance block purpose subsection consumer reporting agency rescinds block presence information file consumer prior blocking information evidence whether consumer knew known consumer obtained possession good service money result block exception resellers reseller file section shall apply consumer reporting agency consumer reporting agency reseller b time request consumer subsection section otherwise furnishing reselling consumer report concerning information identified consumer c informs consumer mean consumer may report identity theft bureau obtain consumer information regarding identity theft reseller file sole obligation consumer reporting agency section regard request consumer section shall block consumer report maintained consumer reporting agency subsequent use consumer accordance provision subsection section identifies consumer reporting agency information file consumer resulted identity theft b consumer reporting agency reseller identified information notice carrying obligation paragraph reseller shall promptly provide notice consumer decision block file notice shall contain name address telephone number consumer reporting agency consumer information obtained resale e exception verification company provision section apply check service company acting issue authorization purpose approving processing negotiable instrument electronic fund transfer similar method payment except beginning business day receipt information described paragraph subsection section check service company shall report national consumer reporting agency described section p title information identified subject identity theft report resulting identity theft f access blocked information law enforcement agency provision section shall construed requiring consumer reporting agency prevent federal state local law enforcement agency accessing blocked information consumer file agency could otherwise obtain access subchapter
credit_reporting,block except otherwise provided section consumer reporting agency shall block reporting information file consumer consumer identifies information resulted alleged identity theft later business day date receipt agency appropriate proof identity consumer copy identity theft report identification information consumer statement consumer information information relating transaction consumer b notification consumer reporting agency shall promptly notify furnisher information identified consumer subsection section information may result identity theft identity theft report filed block requested section effective date block c authority decline rescind general consumer reporting agency may decline block may rescind block information relating consumer section consumer reporting agency reasonably determines information blocked error block requested consumer error b information blocked block requested consumer basis material misrepresentation fact consumer relevant request block c consumer obtained possession good service money result blocked transaction transaction notification consumer block information declined rescinded subsection affected consumer shall notified promptly manner consumer notified reinsertion information section b title significance block purpose subsection consumer reporting agency rescinds block presence information file consumer prior blocking information evidence whether consumer knew known consumer obtained possession good service money result block exception resellers reseller file section shall apply consumer reporting agency consumer reporting agency reseller b time request consumer subsection section otherwise furnishing reselling consumer report concerning information identified consumer c informs consumer mean consumer may report identity theft bureau obtain consumer information regarding identity theft reseller file sole obligation consumer reporting agency section regard request consumer section shall block consumer report maintained consumer reporting agency subsequent use consumer accordance provision subsection section identifies consumer reporting agency information file consumer resulted identity theft b consumer reporting agency reseller identified information notice carrying obligation paragraph reseller shall promptly provide notice consumer decision block file notice shall contain name address telephone number consumer reporting agency consumer information obtained resale e exception verification company provision section apply check service company acting issue authorization purpose approving processing negotiable instrument electronic fund transfer similar method payment except beginning business day receipt information described paragraph subsection section check service company shall report national consumer reporting agency described section p title information identified subject identity theft report resulting identity theft f access blocked information law enforcement agency provision section shall construed requiring consumer reporting agency prevent federal state local law enforcement agency accessing blocked information consumer file agency could otherwise obtain access subchapter according fair credit reporting act section required federal law verify physical verification original signed consumer contract account post credit report otherwise anyone paying reporting service could fax mail email fraudulent account demand see verifiable proof original consumer contract signature file account listed failure positively verify account hurt ability obtain credit fcra unverified account must removed unable provide copy verifiable proof must remove account listed
credit_reporting,block except otherwise provided section consumer reporting agency shall block reporting information file consumer consumer identifies information resulted alleged identity theft later business day date receipt agency appropriate proof identity consumer copy identity theft report identification information consumer statement consumer information information relating transaction consumer b notification consumer reporting agency shall promptly notify furnisher information identified consumer subsection section information may result identity theft identity theft report filed block requested section effective date block c authority decline rescind general consumer reporting agency may decline block may rescind block information relating consumer section consumer reporting agency reasonably determines information blocked error block requested consumer error b information blocked block requested consumer basis material misrepresentation fact consumer relevant request block c consumer obtained possession good service money result blocked transaction transaction notification consumer block information declined rescinded subsection affected consumer shall notified promptly manner consumer notified reinsertion information section b title significance block purpose subsection consumer reporting agency rescinds block presence information file consumer prior blocking information evidence whether consumer knew known consumer obtained possession good service money result block exception resellers reseller file section shall apply consumer reporting agency consumer reporting agency reseller b time request consumer subsection section otherwise furnishing reselling consumer report concerning information identified consumer c informs consumer mean consumer may report identity theft bureau obtain consumer information regarding identity theft reseller file sole obligation consumer reporting agency section regard request consumer section shall block consumer report maintained consumer reporting agency subsequent use consumer accordance provision subsection section identifies consumer reporting agency information file consumer resulted identity theft b consumer reporting agency reseller identified information notice carrying obligation paragraph reseller shall promptly provide notice consumer decision block file notice shall contain name address telephone number consumer reporting agency consumer information obtained resale e exception verification company provision section apply check service company acting issue authorization purpose approving processing negotiable instrument electronic fund transfer similar method payment except beginning business day receipt information described paragraph subsection section check service company shall report national consumer reporting agency described section p title information identified subject identity theft report resulting identity theft f access blocked information law enforcement agency provision section shall construed requiring consumer reporting agency prevent federal state local law enforcement agency accessing blocked information consumer file agency could otherwise obtain access subchapter according fair credit reporting act section required federal law verify physical verification original signed consumer contract account post credit report otherwise anyone paying reporting service could fax mail email fraudulent account demand see verifiable proof original consumer contract signature file account listed failure positively verify account hurt ability obtain credit fcra unverified account must removed unable provide copy verifiable proof must remove account listed demand following account verified removed immediately
credit_reporting,block except otherwise provided section consumer reporting agency shall block reporting information file consumer consumer identifies information resulted alleged identity theft later business day date receipt agency appropriate proof identity consumer copy identity theft report identification information consumer statement consumer information information relating transaction consumer b notification consumer reporting agency shall promptly notify furnisher information identified consumer subsection section information may result identity theft identity theft report filed block requested section effective date block c authority decline rescind general consumer reporting agency may decline block may rescind block information relating consumer section consumer reporting agency reasonably determines information blocked error block requested consumer error b information blocked block requested consumer basis material misrepresentation fact consumer relevant request block c consumer obtained possession good service money result blocked transaction transaction notification consumer block information declined rescinded subsection affected consumer shall notified promptly manner consumer notified reinsertion information section b title significance block purpose subsection consumer reporting agency rescinds block presence information file consumer prior blocking information evidence whether consumer knew known consumer obtained possession good service money result block exception resellers reseller file section shall apply consumer reporting agency consumer reporting agency reseller b time request consumer subsection section otherwise furnishing reselling consumer report concerning information identified consumer c informs consumer mean consumer may report identity theft bureau obtain consumer information regarding identity theft reseller file sole obligation consumer reporting agency section regard request consumer section shall block consumer report maintained consumer reporting agency subsequent use consumer accordance provision subsection section identifies consumer reporting agency information file consumer resulted identity theft b consumer reporting agency reseller identified information notice carrying obligation paragraph reseller shall promptly provide notice consumer decision block file notice shall contain name address telephone number consumer reporting agency consumer information obtained resale e exception verification company provision section apply check service company acting issue authorization purpose approving processing negotiable instrument electronic fund transfer similar method payment except beginning business day receipt information described paragraph subsection section check service company shall report national consumer reporting agency described section p title information identified subject identity theft report resulting identity theft f access blocked information law enforcement agency provision section shall construed requiring consumer reporting agency prevent federal state local law enforcement agency accessing blocked information consumer file agency could otherwise obtain access thissubchapter according fair credit reporting act section required federal law verify physical verification original signed consumer contract account post credit report otherwise anyone paying reporting service could fax mail email fraudulent account demand see verifiable proof original consumer contract signature file account listed failure positively verify account hurt ability obtain credit fcra unverified account must removed unable provide copy verifiable proof must remove account listed
