original_category,narrative
retail_banking,sent via product never received recipient contact information responded contacted via extra email scam reached chase previously avail recipient information tag email used
mortgages_and_loans,debt sent dispute letter
retail_banking,transferred held fund two week utilized float respond repeated request release fund interest interest due bad business
credit_reporting,original creditor opened capital one bank usa n reported bk sold twiced opened bk filed continues bring credit score disputed respond overview paid collection amount balance highest balance opened yr mo account status open type responsibility individual remark dismissed original creditor name capital one bank usa n
credit_reporting,original creditor opened reported bk sold twiced opened bk filed continues bring credit score disputed respond overview paid collection amount balance highest balance opened yr mo account status open type responsibility individual remark dismissed original creditor name
credit_reporting,supposedly owed experian claim owe amount mine say term month old opened account
mortgages_and_loans,forgiveable silent loan suppose receive refund living address year lived since instructed pay silent loan could refinance different mortgage company balance silent loan paid full original fha loan sold loan midland mortgage company remaining silent loan submitted midland later folded business unable contact midland mortgage company active mortgage holder company informed midland responsible repaying original loan date
retail_banking,stolen money market account branch pd dosnt time bmo need make exception let sign affidavit know make sure ill go jail lying complained
debt_collection,bill paid bill directly company collection agency finance system remove reporting bureau removed even numerous dispute asking remove
debt_collection,sent dispute letter
debt_collection,lj ross company never receive written document telling need pay balance added credit
debt_collection,open balance original creditor c system last reported never open account belong
debt_collection,company claim owe money account company considering ive never lived area company provides service failed recognize respond mailing filed complaint federal trade commission well nothing transpired account
mortgages_and_loans,vanished record refuse account owe money illegal tax offset wage garnishment record answer money dept ed refunded dollar received nearly navient accounting received embezzled extorting money phony default fine fee etc refused pay till account done would owe another im paying loan
retail_banking,taken around last year recently receieved email however frozen fund release date subject important information account reference id xxxxxxxxxxxxx standard encryption tl learn important information account account ending weve decided close account ending observed activity inconsistent term condition called spoke agent said reason listed opening account agreed term condition state may close account time reason unable reopen account wont able open additional account u balance interest earned transferred linked external checking account within business day link link closed check mailed address file within business day account balance currently negative youll held responsible negative balance pending claim well wait reach final decision proceeding account closure need stop writing check cancel automatic deposit payment account right away restricted future use question please call u day week called agreed release certain amount threatened file ftc report still holding fund filing thanks claim support center capital one member fdic product service offered capital one member fdic capital approximate total stolen usd
retail_banking,stolen cashapp account money stored actual cashapp wallet bank account woke text company time stamped cash security lock turned immediately logged app discovered stolen form separate transaction minute hacking account immediately filed complaint thru app transaction several hour later emailed back asking additional info immediately provided following business day received another email asking additional info provided trying reach company day day regasrding disput process status inl response appear keep getting appears system generated email constantly asked additional info attach copy email contact talk actual person seems live person handling email well trusted company handling money extremely upset one reached back regarding fraudulent charge company allow someone make several transaction back back back immediately hacking someone account turning security setting without suspecting fraud email received back company asked request refund person sent requested progress expect thief refund something intentionally stolen single parent extremely upset person money sent send money person security setting turned face recognition therefore dont company allowed someone hack account device thats even mine disable security setting even able steal money dont understand im irritated frustrated feel violated feel like robbed
retail_banking,cash deposit bonus promised getting direct deposit employer direct deposit received yet bonus promo never credited sofi term read sofi credit member meet qualification criterion stated cash bonus deposited sofi money account within two week qualification
retail_banking,taken two different customer without authorization service performed
credit_card,fraudulently taken account bank america atm upon noticing immediately contacted bank america reported fraud opened claim set security measure account prevent fraudulent atm withdrawal debited amount pending investigation taken bank america atm transaction account show time taken bank america atm taken bank america atm taken account bank america atm upon realizing fraudulent charge occurred contacted bank opened second claim debited money pending investigation although access evidence could need ie camera bank statement etc found case fraud immediately reopened case told unless able provide proof decision would changed even though proven negligent committed fraud decided file police report bank america sent two letter stating reinvestigated case found account tampered found fraud would receiving money back day letter still access online banking account anything called bank america informed although case settled overturned due new policy would need fax copy police report wanted escalate reopen case addition removed credit put account negative time couple unemployment deposit hit account took money cover difference due account negative protect money first place revictimized along way given completely contradicting information every single representative spoke stealing additional money cover account balance negative
debt_collection,notice debt verfication account debt
retail_banking,taken checking account know person quickpay payment till day chase given back money already filed complaint apparently happening lot chase customer
credit_reporting,astute business person keep daily tab finance credit monitoring account balance anywhere use money pay extra mortgage month see balance decrease aggressively paying debt well didnt expect see though equifax noticed account paid zero across board equifax affected open account regarding equifax credit report alarming say least showed owing good standing showed owing good standing showed owing good standing showed owing good standing receives additional month reduce term mortgage first called check phone application see institution reporting back verified calling lender showed owing auto withdrawal showed time auto withdrawal showed time auto withdrawal showed time auto withdrawal spoke equifax customer service employee told lender reported suggested call lender suggested could repost balance said might worth try get correct information reissued account showing paid credit score equifax actually dropped concerned like understand point swing suggested open inquiry four account erroneous info investigation conducted lender following balance sent equifax score bounced back change happened negatively made remark credit inquiry made equifax lowered score point respectively frustrating error made equifax score stellar credit affected error enjoyed credit score happened
credit_reporting,sent notice information verified credit report received notice information remain report proof provided debt mine early sent notice creditor verify send proof debt mine update erroneous reporting data credit report received response waiting least day reply attached proof correspondence proof receipt proof identity requesting prompt deletion report resolution challenge thank time assistance matter
credit_reporting,submitted request deletion unverified information removed account information investigated deleted credit report noticed deleted information reinserted credit report received correspondence credit bureau reporting creditor sent complaint regarding reinsertion filed complaint cfpb collection added back transunion credit report clear violation consumer protection right noticed recent late payment reporting report looked find transunion shown error reporting recent account opened looked past credit report erroneous previously deleted account showed open date plainly obvious credit held hostage time like utterly attached proof correspondence review request assistance prompt deletion information report harming score ability obtain credit help family thank time assistance
credit_reporting,submitted request deletion unverified information removed account information investigated deleted credit report noticed deleted information reinserted credit report received correspondence experian reporting creditor sent complaint experian regarding reinsertion filed complaint cfpb noticed recent late payment reporting report looked find experian shown error reporting recent account opened looked past credit report erroneous previously deleted account showed open date plainly obvious credit held hostage time like utterly attached proof correspondence review request assistance prompt deletion information report harming score ability obtain credit help family thank time assistance
mortgages_and_loans,applied new mortgage loan closure loan funded contacted title search record show property placed back trust return phone call contacted follow return phone call emailed closing manager follow emailed notified deed recorded incorrectly following recorder office remedy emailed asking status emailed asking status emailed two option waiting lender provide emailed frustration dragging long response loan made numerous attempt phone email communication remedy negligence yet provide solution timely response
debt_collection,paypal card stolen possession someone withdrew twice account gone local store turned local law enforcement paypal reimbursed withdraws done two separate one iowa iowa plus withdraw fee withdraw paypal expecting pay back even police report due fact checked balance visit withdraws
credit_reporting,summary spouse unable manage existing equifax security freeze timely manner since security pin mailed u equifax longer accepted mean verify identity manage existing security freeze present equifax automated website phone support system verify identity based supplied menu response spouse situation resulted ongoing personal financial harm impossible manage security freeze within reasonable time frame necessary credit inquiry take place notably past year bank account application rejected unable verify identity establish account unable process temporary security freeze lift facilitate employment background check seriously applying new residence endangered time sensitive credit check return result contacting equifax customer service multiple occasion provided resolution date recourse offered live customer service representative process future action related security freeze via mail fax method ineffectual facilitate timely management security freeze believe right fair credit reporting act fcra violated equifax due unreasonable hardship managing protection security freeze additional detail security freeze spouse initially placed response unprecedented data breach equifax exposed year extreme negligence revealed breach addition status u military veteran previously conducted work related national security require maintain security freeze national credit reporting agency cra approximately managing equifax security freeze possible via automated phone service security pin number provided u via mail entered verify identity use security pin number discontinued equifax point without notification u thereafter equifax would facilitate access manage security freeze internet phone new automated identity verification system satisfied resulted current predicament automated verification system accept response u sufficient multiple attempt spouse achieve resolution contacting equifax phone support representative ineffectual last occasion reference equifax support case spoke senior support representative informed security freeze could henceforth managed solely via request sent mail fax procedure would also need repeated every future request explanation offered burden spouse insufficient credit history verify identity equifax automated system word due decision limit exposure loan financial product personal life excluded automated system manage security freeze timely manner equifax also declined provide recourse verify identity manner would resolve identity verification issue durable manner thereby restore routine access manage credit information via equifax website automated phone system unfortunately possible process temporary security freeze lift timely manner via mail fax without risking personal financial hardship service provider routinely process credit inquiry much quickly mail fax request processed consequently decision equifax discontinue security pin based service identity verification also providing notification comparable alternative resulted spouse reasonable mean process essential business affair addition contacting customer support spouse submitted consumer complaint georgia office attorney general equifax headquartered complaint specifically requested assistance resolve ongoing identity verification problem however complaint instead produced bizarre troubling outcome equifax arbitrarily processed lift spouse security freeze even though date lift requested seriously spouse attorney general complaint submitted via publicly accessible state operated website required verification identity beyond collecting name address phone number effect equifax processed temporary lift spouse security freeze without authorization without meaningful verification whatsoever complaint actual origin plainly demonstrated equifax fully capable lifting security freeze even individual identity appropriately verified relaying information outcome attorney general complaint nevertheless produced accommodation equifax support also noted phone support representative recommended two occasion permanently remove security freeze favor adopting equifax alert service alternative indicated alert service would facilitate timely method verifying identity continuing utilize security freeze protection would amount attempt compel u away using protected right use security freeze fcra today spouse still prevented managing security freeze using equifax website calling automated phone system transmitted notice equifax customer service offering final opportunity resolve problem received meaningful response noted equifax national cra produced situation impossible properly manage existing security freeze separately spouse also unable access routine credit report equifax without submitting request via mail fax possible u avoid conducting business equifax ever would ideal resolution since privately operated cras commissioned united state government manage consumer information despite repeatedly demonstrating extreme negligence responsibility protect sensitive personal information choice work conundrum exercising right fcra going prevented faulty automated system incompatible choose conduct private personal affair thank due attention matter attachment following information supplied complaint security pin notice equifax online complaint notice ga attorney general security freeze lift notice equifax online complaint file closed notice ga attorney general additional information supplied upon request
retail_banking,chase far u tried send money banker mistake banker told success closed account going back asked banker whether ok told ok asked send check said choice going u show id problem refused go u sent check lived ex roommate sent check went bank convert banker told fake day later banker gave call chase refused pay money said stop believe chase far really believe allow chase please give money back chase bank fraud ready sue bank
credit_reporting,mortgage loan transferred homeloanserv thought set electronic account autopay begin automatic payment checked beginning realized payment made spoke representative asked rep help online account make sure electronic payment good go school closure middle school teacher omg mortgage paid called homeloanserv help received message encouraging use online resource instead waiting representative waited another message told charged using real person instead going online route still waited bad accustomed missing payment elevator music stopped playing thought disconnected nope think company hope people hang repxxxx took call helpful informed could make late payment sign future auto payment date information passed told good go visit productive thought convo told rep especially concerned late payment affecting credit led believe need worry fixed payment time auto payment occurred time lender informed previously approved loan could go dropped significantly called homeloanserv today first spoke kind helpful listened story admitted could little help perhaps team lead could passed think name seemed defense soon conversation began admit paying mortgage time responsibility asked could somehow help convey loan company shortage fund refusal pay led late payment misunderstanding information given requested help asked could help inform loan company currently good standing paid full know many time repeated done due diligence best inform account standing said tried call might speak anyone phone number came recognize sure answer many warning scam con pandemic quarantine receive written notice time company current mailing address agreed done could information still needed help could provide information loan officer would suggest mean pay time reminded done due diligence said could talk supervisor said would great like maybe supervisor could send email put voice mail said someone would best get back next hour ugh person took little breather tried start called homeloanserv listened menu pushed zero listened menu hello line received similar polite line reasoning help asked could get transcript previous phone conversation would like read see remembering conversation incorrectly one put hold checked lead think returned told need subpoena access transcript seriously feel like financial company provided help information needed asked feel misinformation given led problem late payment late payment led automated negative credit report seriously screwed life turned company help remedy situation found deaf ear request forbearance nation crisis budgeted appropriately able willing make payment needed guidance guidance sought misled think representative initially helped meant send miserable wormhole perhaps misheard quarantine tiresome window time think rep spoke called second time meant give false hope credit think effort reach help willingness paid full attest sincerity dilemma think leader financial institution care bean person predicament placed due careless guidance think sad know making payment time responsibility fell short best remediate soon possible also believe painting accurate picture one payment history credit one homeloanserv responsibility take ownership part played asked help dismissal instead
retail_banking,online deposit chase checking account check drawn chase account live azand address check arizona received notice deposit put hold fund would available account message vague provide concrete justification attempted call chase time put hold minute time gave understanding chase required law make available within first hr following hr
debt_collection,harris harris harris harris harris harris refuse show thier account number attempting collecting refussing contact state outstanding balance due insyrance paid full
debt_collection,gla collection co gla refuse show thier account number attempting collecting refussing contact state outstanding balance due insyrance paid full
debt_collection,credit report provided rmp llc collection old account provide account number paperwork trying collect rmp llc also new buyer account yeras old also
mortgages_and_loans,refinance home paid old mortgage per bank record mailed escrow refund ck check received called bank check told wait called bank regarding ck told stop payment new check issued called bank regarding ck told would stop payment issue new ck told previous call told stop payment issue new check also today told sorry wait bank retaining escrow money harming lot time property tax virus hollydays bank payment interest penalty using money lying check got loss receive many letter time
debt_collection,act fraudulent account appearing credit profile disputing long time luck
debt_collection,credit management lp credit managemnt told bill inn contacted stated outstanding bill everything good standing credit management refuse contact resolve issue account also searched social security number found account balance
credit_reporting,letter unfair deceptive credit practice ftc act act continue prohibit unfair deceptive act ncua may determine statutory violation exists depending fact ftc violation
credit_reporting,letter unfair deceptive credit practice ftc act act continue prohibit unfair deceptive act may determine statutory violation exists depending fact ftc violation
debt_collection,credit management lp credit managemnt told inn contacted stated outstanding bill everything good standing credit management refuse contact resolve issue account also searched social security number found account balance
debt_collection,americollect inc americollect inc refuse show thier account number attempting collecting refussing contact indiana state outstanding balance due insyrance paid full
debt_collection,national credit managemnt national credit removed collection report since amount payment refuse anything item report
credit_reporting,true identity theft victim identity theft information listed appears credit report relate transaction made result identity please block information report experian report number account name account number date opened account number date opened account account name account number dated open account file number account name account number date opened account number date opened account name account number dated account name account number account also address listed report ive never lived ga xxxxapartment complex ga xxxxapartment complex ga xxxxapartment complex ga xxxxapartment complex ga xxxxsingle family ga xxxxsingle family ga xxxxapartment complex ga complex ga xxxxsingle family ga family ga complex ga xxxxmultifamily ga xxxxmultifamily ga xxxxapartment complex ga xxxxsingle family ga xxxxmultifamily ive attempting clear credit report fraudulent item far back successful
credit_reporting,hired third party company rent recovery solution collect debt say owe never contract rent recovery solution give expressed written consent contact asking rent recovery solution prof alleged debt rent recovery solution pursuant validate claim debt asking rent recovery solution prof lawful contract showing owe reasonable belief respondent violation following using deceptive mean collect debt using unfair unconscionable mean collect attempt collect alleged debt asking proof debt rent recovery solution established since produced ask fraudulent report removed also secretary state filed prof debt lien dent recorded kept secretary state proof alleged debt exist claim please remove erroneous statement credit public servant please provide proof debt signature rent recovery solution
retail_banking,computer locked called tlod charge site get gift card offset charge would go thru ended getting allowal withdraw raised purchased gift card bank said would reimbursed got letter investigation determined fraud occured yes took card pout gave number want recover money information call looking see wood willing get lawyer help dont know kind bank td bank
retail_banking,bank account jp chase morgan friday received deposit georgia department labor unemployment including back pay back til apparent reason chase decided freeze bank account close hold money reason havent problem account since got worst bank ever morning checked account negative balance decided close account still allowed draw day bank account money send back deposit included deposit time time equal clearly seen money came georgia department labor addressed whole name still closed account good reason
credit_card,made payment told rep payment come citi keep hurass constantly collings call back failed apply payment charged late fee made account delinquent citi crock cheat fraud ripoff bank fight wont let getaway wake gone ripoff errs
