original_category,narrative
credit_card,purchase order day shipping amount receive product week sent followup email exact verbiage paid two day shipping received order company responded im sorry inform due unusually high order volume order shipped several week stock since early due high demand although continuing take order guaranteeing receive order place due time mask order exact shipping date right however guarantee ship soon soon delivers product u getting small shipment shipping first come first served basis appreciate patience fulfill order quickly recommend keeping order lose place line cancel distributor stock moment prefer cancel please note ask via email cancel accordance cancellation policy agreed checkout electronic inventory online requested order canceled refund issued canceled order sent verification order canceled refunded item particulate respirator refunded subtotal shipping tax total usd visa ending refund called disputed amount stated nothing needed submitted address issue recharged item removing called back dispute amount transaction rebillmerchandiserobert ca purchased thu posted wed purchased appears statement transaction rebill ca u followed see status case submitted documentation showing canceled order supposed submit refund called back speak manager case stated dispute ruled favor charge removed card capital one removed purchase bill purchase adjustmentmerchandiserobert j posted fri purchased appears statement purchase adjustment capital one recharges amount transaction rebillmerchandiserobert j purchased thu posted mon purchased appears statement transaction rebill called capital one requested recharge stated visa ruled case pretended remove purchase knew anything case manager ruling favor
credit_card,forwarded message date tue subject please investigate comenity bank retailer card scam sent hello name scammed comenity bank credit card provider company childrens place new york forever victoria secret original credit comenity bank lower limit began charge overage fee along late fee began pay close attention card find limit also changed well incurring overage late fee reached company comenity bank stated would change credit limit original limit reached told summit payment account corrected comenity bank credit card impacted credit score plummeted negative status im currently paying price due corruption affected detrimental way debt due company charging overage fee well late fee even initial credit limit fluctuating tremendously company charge major fee account willing correct account nervous said attorney reason im reaching im employee company ruining credit plz help name contact info thank
retail_banking,forwarded message cc sent friday pdt subject final legal payment well fargo well fargo clearly wrong need look actually opened account see court hearing several different government agency reporting well including branch put open account numerous fraudulent charge debit card connected account clearly due fact well fargo maintain clearly required encryption card keep secure adding damage request small claim lawsuit time take away running business branch required come branch multiple time get fraudulent charge removed actually present strong case proper consumer protection agency well fargo immediately barred issuing account debit card insure agency card adequate prevent fraudulent use also requesting punitive treble damage sum hour take work handle lawsuit along legal cost filing lawsuit county small claim court today well fargo outrageous fraudulent conduct clearly warrant punitive damage also sharing every possible consumer protection agency find would think well fargo enough adverse publicity fraudulent conduct last year introduce small claim suit clearly establishing well fargo established business practice fraud customer ca judge really need reminded might want immediately run bonus payment legal department
credit_reporting,payment history missing credit report specialized loan servicing sl made mistake put account forbearance without authorization knowledge matter fact automatic payment setup month monthly mortgage paid full noticed issue account marked forbearance credit report tried get new home loan another new bank contacted immediately asked fix error provide letter detail please see asks forbearance issue seemed fixed however credit report payment history missing new bank able approve new loan issue missing payment history contacted specialized loan servicing time since phone ask sl thing report payment history fix missing data issue provide letter show account never forbearance payment history past month however waiting week countless email phone call talk multiple supervisor able get either one thing without issue fixed new bank process new loan application therefore need sl help immediately get fixed
credit_reporting,payment history missing credit report made mistake put account forbearance without authorization knowledge matter fact automatic payment setup month monthly mortgage paid full noticed issue account marked forbearance credit report tried get new home loan another new bank contacted immediately asked fix error provide letter detail please see asks forbearance issue seemed fixed however credit report payment history missing new bank able approve new loan issue missing payment history contacted time since phone ask thing report payment history transunion fix missing data issue provide letter show account never forbearance payment history past month however waiting week countless email phone call talk multiple supervisor able get either one thing without issue fixed new bank process new loan application therefore need help immediately get fixed
credit_reporting,payment history missing credit report made mistake put account forbearance without authorization knowledge matter fact automatic payment setup month monthly mortgage paid full noticed issue account marked forbearance credit report tried get new home loan another new bank contacted immediately asked fix error provide letter detail please see asks forbearance issue seemed fixed however credit report payment history missing new bank able approve new loan issue missing payment history contacted time since phone ask thing report payment history experian fix missing data issue provide letter show account never forbearance payment history past month however waiting week countless email phone call talk multiple supervisor able get either one thing without issue fixed new bank process new loan application therefore need help immediately get fixed
credit_reporting,va date complaint experian credit bureau involved decision maker stop cease retaliation discrimination abuse american taxpayer today experian blocked accessing free annual credit report adding restrictive discriminatory condition specifically many proof support fact subjected retaliatory adverse action experian credit bureau allowing participating causing damage financial reputation experian causing severe emotional distress experian impeded ability review credit report therefore anything negative report damage caused full legal responsibility liability experian excuse justify restriction website called condition experian put place experian experian involved decision maker must stop retaliation must pay huge legal consequence illegal act american taxpayer cfpb shall investigate experian unlawful practice reported cfpb several time past year reference experian credit report one previous year year several incorrect information experian insisted keep file within credit bureau named experian experian intent damage financial reputation fact proven fact damage already experian caused mu person please note experian response legal complaint used experian involved decision maker time court law stated herein current state belief knowledge understanding subject correction change kind time legal representative without waiving right circumstance digitally signed filed today within cfpb
credit_reporting,account reported abbreviated name full name servicer account transunion reporting date last payment reporting payment due account time however date inconsistent however transunion reporting date last active show show none date match activity payment made three bureau reporting high credit balance show transunion show amount violation failed addressed repeatedly amount match information reported percent accurately according law transunion repeatedly failed report account dispute removed account dispute comment company reporting account top invalid account number also listed authorized user considered account removed another account reporting listed authorized user considered account reporting high credit limit credit limit left transunion reporting high credit amount credit limit transunion reporting date last active reporting date supposed match since supposed receive exact information company date last payment transunion show date last active also show date last active date last payment show date last active date last payment none date company match reported accurately still also making payment account since paid far two year payment history even reflect none bureau reporting information verified account still reporting wrong making payment ever since company show payment history co however show making payment since reporting wrong show date last active transunion making payment account since however transunion reporting date last payment show last reported date show transunion show information inaccurate reported inconsistently three bureau verify information correct attached evidence refuse change company obligated fcra report information totally accurate severely affecting credit score equifax also reporting credit limit transunion reporting reporting high credit transunion showing three bureau reporting past due balance violation still corrected showing past due amount transunion show account already carrying balance reflect past due amount violation company refusing proper investigation error even asked method verification provide information requested allowed law request
credit_reporting,account reported abbreviated name full name servicer account experian reporting date last payment reporting payment due account time however date inconsistent however reporting date last active experian show show none date match activity payment made three bureau reporting high credit balance show experian show amount violation failed addressed repeatedly amount match information reported percent accurately according law repeatedly failed report account dispute removed account dispute comment company reporting account top invalid account number also listed authorized user considered account removed another account reporting experian listed authorized user considered account reporting high credit limit credit limit left experian reporting high credit amount credit limit reporting date last active experian reporting date supposed match since supposed receive exact information company date last payment transunion show date last active experian also show date last active date last payment show date last active date last payment none date company match reported accurately still also making payment account since paid far two year payment history even reflect none bureau reporting information verified account still reporting wrong making payment ever since company experian show payment history co however show making payment since experian reporting wrong experian show date last active making payment account since however reporting date last payment experian show last reported date experian show show information inaccurate reported inconsistently three bureau verify information correct attached evidence refuse change company obligated fcra report information totally accurate severely affecting credit score also reporting credit limit experian reporting experian reporting high credit transunion showing three bureau reporting past due balance violation still corrected experian showing past due amount show account already carrying balance reflect past due amount violation company refusing proper investigation error even asked method verification provide information requested allowed law request
credit_reporting,usdoexxxx account reported abbreviated name full name servicer account reporting date last payment equifax reporting payment due account time however date inconsistent however reporting date last active show equifax show none date match activity payment made three bureau reporting high credit balance show equifax show amount violation failed addressed repeatedly amount match information reported percent accurately according law repeatedly failed report account dispute equifax removed account dispute comment equifax company reporting account top invalid account number also listed authorized user considered account removed another account reporting listed authorized user considered account equifax reporting high credit limit credit limit left reporting high credit amount credit limit reporting date last active reporting equifax date supposed match since supposed receive exact information company date last payment show date last active also show date last active date last payment equifax show date last active date last payment none date company match reported accurately still also making payment account since paid far two year payment history even reflect none bureau reporting information verified account still reporting wrong making payment ever since company show payment history co however equifax show making payment since reporting wrong show date last active equifax making payment account since however reporting date last payment equifax equifax show last reported date show show information inaccurate reported inconsistently three bureau verify information correct attached evidence refuse change company obligated fcra report information totally accurate severely affecting credit score equifax also reporting credit limit reporting reporting high credit equifax showing three bureau reporting past due balance violation still corrected showing past due amount equifax show account already carrying balance reflect past due amount violation company refusing proper investigation error even asked method verification provide information requested allowed law request
mortgages_and_loans,beginning mortgage held mb financial mb mortgage portfolio purchased bank first quarter mb financial customer began fall behind mortgage payment due unemployment divorce house went foreclosure later sheriff sale home scheduled morning submitted hardship application end documentation specific date letter dated acknowledges application discussed next step never received written verbal confirmation regarding status hardship application day scheduled sheriff sale communication way sale never provided clear determination application made payment brought account current able taking loan group friend would lost home sheriff auction day sale received express mail letter dated date scheduled sheriff sale saying hardship application approved detail trial payment plan received letter timeframe required promised would take full loan friend would made required payment delay review option held numerous call since large payment told trial plan leading loan modification place payment plan fact made brought account current documentation effect extending one call confirm status mortgage department even made branch local branch manager line ensure misunderstanding aspect found process confusing told call branch manager participated could expect receive loan modification agreement end happen told subsequent call would receive end still happened week ago became concerned process might impacted covid pandemic call told loan modification going happen made payment bring account current never told conversation written communication since hardship application submitted end told would need resubmit hardship application go process approved would put overall timeframe modify mortgage nearly year assuming submitted took day review made monthly payment took another one two month get agreement hold two business significant financial responsibility unintelligent lacking understanding fiscal matter found experience absolutely frustrating held commitment submitting cfpb hope might rectify situation potentially others interim planning applying covid hardship forbearance separate reapplication hardship program
credit_card,called request new york state covid relief plan day interest fee waived amex provided relief leading late payment amex refused honor relief day gap insists charging late fee
credit_card,capital one secured credit account opened name closed outstanding balance never opened account knew nothing started receiving mail
credit_reporting,collection account acct opened balance account acct opened balance account
debt_collection,collection agency system inc mn phone sent letter regarding debt owe immediately sent system inc u postal certified letter stating owe debt contact certified mail claim disputed report agency resolved received letter system immediately responded received correspondence illigal practice system reported credit bureau consecutive month original letter responded copy certified receipt plus consecutive month past original letter system misrepresented information bureau date last payment thank
mortgages_and_loans,current loan provident funding applied refinance provident funding variable interest rate went loan applied refinance downpayment reduce depth also monthly payment locked interest rate day current payment going approximately provided income debt information provident funding provident funding play game interest rate arm went provided every information suspended loan application able reach mortgage broker always get voicemail responded email underwriter approving due ratio
mortgages_and_loans,current loan got deferment paid back credit history yet lost job due covid therefore asking original bank ally lower rate allow lower payment every bank offering applied full page document today still reply called time portal representative tell use work call get told need one piece documentation time refuse allow speak even email underwriter yet applying original mortgage one dedicated rep could communicate rep told yes document would word within day waited till called told go website told work read underwriter note documentation old would start
mortgages_and_loans,closed mortgage dovenmuhle mortgage paid full significant remaining balance escrow account waited refund check never arrived called dovenmuhle said sure check sent promised send waiting customary week processing business day delivery waited called back check never sent said could update new address phone email signed document asking updated mailing address asked wait day call back check asked overnighted agreed called initially said never received email resent two different email address eventually said found sure original attempt asked overnighted rep said needed manager approval meeting said call back manager called back left message saying check would processed within week mailed called back told way overnight asked manager put hold minute called back go entire thing asking manager put hold minute went automated survey disconnected waaaayyyy past day window refund escrow fund entire process unacceptable illegally hold money like
mortgages_and_loans,contacted bank america boa mortgage customer service number spoke representative discussed covid assistance option verifying account stated one option deferment agreed enter deferment stated month missed payment would added end current instructed watch mail written correspondence arrangement also would receive phone call mortgage department update covid need closer end deferment period xxxxxxxx received call mortgage division stated eligible deferment entered explained never agreed forbearance fact option discussed deferment entered representative wrote ceo boa received email resolution specialist called returned call call acknowledged incorrect information provided initial covid assistance call state fha offer option discussed option communicated option favorable place household financial bind restated offered deferment forbearance loan communicated option disclosed still would opted forbearance mortgage expressed planned escalate complaint felt bait switch situation question guideline call never mentioned anything loan type affecting coivd option state boa control must follow fha loan guideline plan touch based either friday early following week contacted fha resource line spoke state boa fha provides loan guideline hud website http tell mortgage holder contact mortgage company servicer yet providing false information impact finance million american
credit_reporting,xxxxxxxx credit card year disputed charge vendor xxxxxxxx said reversed charge pay charged late fee interest paying statement amount xxxxxxxx reversed late fee incident showing credit report late payment closed account year never paid late underpaid amount owed mostly kept balance
credit_reporting,xxxxxxxx credit card year disputed charge vendor xxxxxxxx said reversed charge pay xxxxxxxx charged late fee interest paying statement amount xxxxxxxx reversed late fee incident showing credit report late payment closed account year never paid late underpaid amount owed mostly kept balance
credit_reporting,error transunion credit report file number date issued score three error corrected one error working one error getting information error high balance credit limit disputed error transunion without result error transunion without result went step bank say highest balance please ask transunion fix write anymore letter spend anymore time hold telephone
mortgages_and_loans,converted lease vehicle three month lease end date sale dealer accepted deal including tax remaining payment existing lease deal work try convert lease vehicle sale office provide quote based current payoff amount car agreed bought vehicle problem sale manager dealer failed pay payment current lease instead paid two payment saying contract written manner checked contract paper nowhere mentioned converting lease vehicle new also financial document say current payoff amount much dealer agreed pay existing lease initially paid two payment ask benz financial service remove turn fee extra mileage called multiple remove well felt cheated deal providing proper information one payment need pay financial company also car sold used car knowledge
mortgages_and_loans,made extra payment may loan principal payment applied principal several extra payment automatically allocated late fee ally electronic payment system automatically allocates fund first payment second outstanding fee third principal ally policy state customer may request payment fund applied principal called emailed ally first time occurred stated would like payment allocated principal chose paying principal faster allows le interest finance charge time called ally would reallocated portion amount late fee principal process would also take long reallocation would cross another payment would call get payment allocated late fee principal ally would allocate le amount allocated stand ally applied account fund removed late fee reallocated account
mortgages_and_loans,originally reached well fargo apply refinancing mortgage currently hold submitted application paid upfront fee applied survey documentation paperwork completed loan submitted approval final decision forthcoming within week notified loan rejected due debt income ratio better credit score last approved le year ago since eliminated different monthly mortgage payment would reduce current mortgage year year p l reflects higher income current apr would reduced thank help
debt_collection,purchased laptop laptop damaged turned repair center full replacement insurance conns issued replacement laptop full warranty conns reported credit possessed laptop charged laptop contract since fighting get laptop possession conns credit report conns refused conns lied added additional contract agree another contract paperwork contract contract exact product contract unit charged laptop day conns settled matter sent collection settlement laptop possession conns laptop repair center never returned contract
mortgages_and_loans,trying close loan month provided income payment stub statement account tax form work employee also formally applied penfed loan number penfed asked provide proof precedence several deposit statement account deposit check one transfer account penfed asking provide invoice legal service rendered related check deposit registered account provide detail copy invoice provided service lawyer violate privilege none deposit exceed reported paid tax professional service rendered believe penfed going beyond needed evaluate income payment capacity
credit_reporting,got multiple account denial citing lexisnexis report ordering nexislexis report since never received copy disclosure recently month requested report paper application form submitted following inquiry lexis nexis informed mailed link download file however never received document consistent experience lexis nexis never received anything followed lexis nexis refused look file customer service agent constantly put inquiry loop request followed never sent paper work lexisnexis ignored complaint cold without consumer report right information violated severely company ca even get bank account us lexisnexis system
