original_category,narrative
credit_reporting,name trying report incorrect information credit report past year success according recent credit report request several inaccurate account report demand removal violation following applicable credit reporting law usc exercising right audit record claim verified credit bureau debt usc requires early warning notice notified said person placed credit report violation count several item report legally allowed report violation count account report belong identity may compromised violation count compliance procedure violation count creditor record proper identification notice name address employment information hard inquiry inaccurate addition several derogatory account relationship business incorrect information demand removed credit account according reporting law listed name address employment information hard inquiry debt collection need cleared credit report reported info reported nj nj hard inquiry inquiry credit union co inquiry inquiry credit union inquiry miscellaneous inquiry bank xxxxxxxx inquiry bank inquiry credit union xxxxxxxx inquiry bank inquiry bank inquiry utility fuel debt reported closed
mortgages_and_loans,sl continues receive payment city every month behalf family member excess lying received payment refusing apply payment account check clearly account number written payment sent every month since receipt every check sent payment question sent month envelop payment behalf sl applying account applying payment behalf family member sl making appear though mortgage delinquent time call ask family member payment applied get robotic answer customer service teller see applied calling spoke teller asked delinquency account explained sl applying payment said would make note account question sl apply one payment refuse apply payment enclosed envelop account notated payment sl addressed issue answer preceding question resolve
debt_collection,previously submitted complaint via cfpb website company failed respond directly cfpb closed complaint company need respond directly complaint via cfpb portal previous complaint well one advised give permission company submit information cfpb company continues violate right fcra guideline company claimed sent response directly could verify submitted complaint also never verified reporting adding negative derogatory information credit report never sent anything else never contacted continue submit complaint respond answer cfpb website submit letter company letterhead advising deleted negative information reporting illegally else would filing complaint fraudulently reporting information credit using stall tactic gather information effort harass fraudulently use personal information want contacted mean except portal following received alert credit bureau collection account added credit report logged credit monitoring service information listed reflects collection agency c system located mn phone state partial account number opened amount original debtor never heard debt collector prior today contacted notified debt listed company sent correspondence advising debt creditor advised option dispute debt called company time today call recorded end find information dispute account transferred various department information given attempted fraudulently ask question pertaining debt like moved last month previous phone number used name variation besides actual name ever married divorced ever used alias unprofessional question rather advise debt felt insulted violated harassed felt though company fraud illegally trying get personal information scam fair debt collection practice act state debt collector must send consumer written notice containing amount debt name creditor statement stating consumer day dispute validity debt debt considered valid debt collector consumer fails dispute debt within day time period give admission liability agency follow process right ground collect report debt credit bureau must immediately remove debt debt consumer credit report company contact within day assuming debt therefore violated right need removed credit bureau give company permission contact via telephone employer email mean except u mail
credit_reporting,see little concerned way conducting investigation negative item sent last month noticed attachment clearly note impossible open true investigation company listed continue report incomplete inaccurate unverifiable information nothing legally sent validate accuracy account listed contacted company well open investigation continue give number contact credit bureau either phone mail website account violation fcra fdcpa many consumer law therefore impossible could say conducted true investigation want general investigation need know contact company document legally provide method investigation
credit_reporting,attachment dear cra manager happy im little shocked method investigation actually dont even understand method investigation ive disputed account several time due several inconsistency error incomplete misleading information way reporting reason always come back verified impossible agency performed truthful investigation cc account continues report misleading information highlighted example actually removed due violation continue reported different date last active last payment different date last reported high balance higher actual balance etc impossible say reporting accurate look report even balance questionable
debt_collection,please shocked reviewed credit report week found multiple inaccuracy credit report major credit bureau collection company never dealt attempted several time ratify issue original creditor credit bureau still reporting inaccurate unverifiable information disputed item credit reporting agency reported confirmed account valid honestly believe ever relationship collection agency original creditor also several inaccuracy account way reporting total violation fcra fdcpa law regulation good faith effort resolve matter amicably must demand proof debt specifically alleged contract instrument bearing signature well proof authority matter absent proof must correct erroneous report past debt mine writing request please provide following information please evidence authorization usc e usc f alleged matter authorization law collection information authorization law collection alleged debt please evidence authorization business operate state please evidence proof alleged debt including alleged contract instrument bearing signature please provide complete account history including charge added collection activity day upon receipt letter provide strict proof contract event provide strict proof contract must cease desist collection effort immediately remove derogatory information reported consumer reporting agency addition need provide agreement writing closing file ceasing collecting activity deleting information related reference number credit report youve furnished information event transfer account attorney without providing proof contract proving claim immediate reported code ethic violation
debt_collection,duplicate complaint per coversations cfpb also agree please review respond thank may concern writing letter notify continuing violation fair credit reporting act section fair collection practice act committed huntington merit several act dispute letter submission made end attempt proved futile time request made even acknowledged response attach article compliant evidencing correspondence took place unequivocally clear never made refusal pay gave notice claim alleged disputed due negligence noncompliance refusal delete unverified information consumer file cost tremendously regard employment opportunity residency approval line approval administrative fee dispute process
mortgages_and_loans,fraud care act law mortgage qualified covid forbearance plan nationstar reporting loan past due scaring homeowner also giving consumer option pay forbearance end loan faced million quarterly loss follow law nationstar decided steal home victim pandemic making attached copy correspondence received clearly see qualified assistance followed payment immediately due loan overdue signed loan also originated loan origination fraud nationstar mortgage admitted required item left escrow loan origination copy attached also claimed escrow fraud theft escrow well within right loan fraud escrow theft confirmed detective file forwarded fbi ic unit assume slowing prosecution
credit_reporting,may name trying report inaccurate item credit report year however credit bureau always try avoid responsibility review remove incorrect item ask authorization attached proof identity clearly complaint written one behind please responsible age make excuse job review compliant carefully know tactic excuse electronic response accepable credit bureau fulfill responsible even intend steal money ignoring collection negative account never owned known according fair credit reporting act demand complaint reviewed carefully regulation time frame day fl fl fl oh fl fl oh current address fl address either old incorrect please delete negative affect account inquiry bank account unauthorized date funisher violate reporting compliance report contact information delete inquiry xxxxxxxx auto financing account unauthorized date funisher violate reporting compliance reporting dispute status delete inquiry auto financing contact inquirer mail account unauthorized date funisher violate reporting compliance reporting dispute status delete inquiry automobile dealer old account unauthorized date funisher violate reporting compliance reporting dispute status delete inquiry auto financing contact inquirer mail account unauthorized date funisher violate reporting compliance reporting dispute status delete inquiry bank account unauthorized date funisher violate reporting compliance reporting dispute status delete inquiry automobile dealer new auto finance inquiry bank account unauthorized date funisher violate reporting compliance reporting dispute status delete inquiry auto financing account unauthorized date funisher violate reporting compliance reporting dispute status delete inquiry credit union account unauthorized date funisher violate reporting compliance reporting dispute status delete inquiry automobile dealer new account unauthorized date funisher violate reporting compliance reporting dispute status delete inquiry bank account unauthorized date funisher violate reporting compliance reporting dispute status delete inquiry credit union account unauthorized date funisher violate reporting compliance report contact information delete immediately inquiry auto financing contact inquirer mail account unauthorized date funisher violate reporting compliance report contact information delete immediately inquiry credit union account unauthorized date funisher violate reporting compliance report contact information delete immediately inquiry miscellaneous reptg agency account unauthorized date funisher violate reporting compliance report contact information delete immediately reported collection mine never financial obligation company account exist account without notice disclosure mailed violated fcra disclosure investigative consumer report must receive disclosure letter received must made writing mailed otherwise delivered consumer later three day date report first requested provide documentation account proof mailed sent account delete reported collection belong provide full documentation delete immediately
credit_reporting,may name trying report inaccurate item credit report year however credit bureau always try avoid responsibility review remove incorrect item ask authorization attached proof identity clearly complaint written one behind please responsible age make excuse job review compliant carefully know tactic excuse electronic response accepable credit bureau fulfill responsible even intend steal money ignoring collection negative account never owned known according fair credit reporting act demand complaint reviewed carefully regulation time frame day fl fl fl oh fl fl oh current address fl address either old incorrect please delete negative affect account inquiry bank account unauthorized date funisher violate reporting compliance report contact information delete inquiry auto financing account unauthorized date funisher violate reporting compliance reporting dispute status delete inquiry auto financing contact inquirer mail account unauthorized date funisher violate reporting compliance reporting dispute status delete inquiry automobile dealer old account unauthorized date funisher violate reporting compliance reporting dispute status delete inquiry auto financing contact inquirer mail account unauthorized date funisher violate reporting compliance reporting dispute status delete inquiry bank account unauthorized date funisher violate reporting compliance reporting dispute status delete inquiry automobile dealer new inquiry bank account unauthorized date funisher violate reporting compliance reporting dispute status delete inquiry auto financing account unauthorized date funisher violate reporting compliance reporting dispute status delete inquiry credit union account unauthorized date funisher violate reporting compliance reporting dispute status delete inquiry automobile dealer new account unauthorized date funisher violate reporting compliance reporting dispute status delete inquiry bank account unauthorized date funisher violate reporting compliance reporting dispute status delete inquiry credit union account unauthorized date funisher violate reporting compliance report contact information delete immediately inquiry auto financing contact inquirer mail account unauthorized date funisher violate reporting compliance report contact information delete immediately inquiry credit union account unauthorized date funisher violate reporting compliance report contact information delete immediately inquiry miscellaneous reptg agency account unauthorized date funisher violate reporting compliance report contact information delete immediately reported collection mine never financial obligation company account exist account without notice disclosure mailed violated fcra disclosure investigative consumer report must receive disclosure letter received must made writing mailed otherwise delivered consumer later three day date report first requested provide documentation account proof mailed sent account delete reported collection belong provide full documentation delete immediately
credit_reporting,may concern name trying report inaccurate account credit report year credit bureau always avoid responsible review report excuse tactic make want real person really authority responsible review incorrect account time frame day according fair credit reporting act name incorrect please delete fl fl address either old incorrect enclosed proof current address attachment box xxxxxxxx employment mine business please remove reported original contract application proof show consent signature person receipt information method verification using electronic response acceptable proof must verified collection belong creditor collection agency sign contact information accordance fcra disclosure investigative consumer report must receive disclosure letter received must made writing mailed otherwise delivered consumer later three day date report first requested never received mailed disclosure even notice collection provide proof sent notice must delete inaccurate account inquiry unauthorized inquiry data furnisher violated reporting compliance reporting contact information inquiry unauthorized inquiry data furnisher violated reporting compliance reporting contact information xxxxxxxx inquiry unauthorized inquiry data furnisher violated reporting compliance reporting contact information xxxxxxxx reported collection account belong creditor collection agency signed contract information collection agency account number contact information associated account credit report demand removed reported original contract application proof show consent signature person receipt information method verification using electronic response acceptable proof must verified collection belong creditor collection agency sign contact information demand removal violation following applicable credit reporting law usc exercising right audit record claim verified credit bureau debt usc requires early warning notice notified said person placed credit report
credit_reporting,may concern name trying report inaccurate account credit report year credit bureau always avoid responsible review report excuse tactic make want real person really authority responsible review incorrect account time frame day according fair credit reporting act name incorrect please delete fl fl address either old incorrect enclosed proof current address attachment box employment mine business please remove reported original contract application proof show consent signature person receipt information method verification using electronic response acceptable proof must verified collection belong creditor collection agency sign contact information accordance fcra disclosure investigative consumer report must receive disclosure letter received must made writing mailed otherwise delivered consumer later three day date report first requested never received mailed disclosure even notice collection provide proof sent notice must delete inaccurate account inquiry unauthorized inquiry data furnisher violated reporting compliance reporting contact information inquiry unauthorized inquiry data furnisher violated reporting compliance reporting contact information inquiry unauthorized inquiry data furnisher violated reporting compliance reporting contact information reported collection account belong creditor collection agency signed contract information collection agency account number contact information associated account credit report demand removed reported original contract application proof show consent signature person receipt information method verification using electronic response acceptable proof must verified collection belong creditor collection agency sign contact information demand removal violation following applicable credit reporting law usc exercising right audit record claim verified credit bureau debt usc requires early warning notice notified said person placed credit report
credit_reporting,may concern name trying report inaccurate account credit report year credit bureau always avoid responsible review report excuse tactic make want real person really authority responsible review incorrect account time frame day according fair credit reporting act name incorrect please delete saint fl fl address either old incorrect enclosed proof current address attachment box employment mine business please remove reported original contract application proof show consent signature person receipt information method verification using electronic response acceptable proof must verified collection belong creditor collection agency sign contact information accordance fcra disclosure investigative consumer report must receive disclosure letter received must made writing mailed otherwise delivered consumer later three day date report first requested never received mailed disclosure even notice collection provide proof sent notice must delete inaccurate account inquiry unauthorized inquiry data furnisher violated reporting compliance reporting contact information inquiry unauthorized inquiry data furnisher violated reporting compliance reporting contact information inquiry unauthorized inquiry data furnisher violated reporting compliance reporting contact information reported collection account belong creditor collection agency signed contract information collection agency account number contact information associated account credit report demand removed reported original contract application proof show consent signature person receipt information method verification using electronic response acceptable proof must verified collection belong creditor collection agency sign contact information demand removal violation following applicable credit reporting law usc exercising right audit record claim verified credit bureau debt usc requires early warning notice notified said person placed credit report
credit_reporting,keep closing request investigation credit profile complying submitted personal identification document instance allowed ignored request instance cfpb online portal start dispute many issue credit report compiled
credit_reporting,name trying report incorrect information credit account past year success see several hard inquiry exist account without notice inquiry inaccurate need removed credit account according recent credit report request several inaccurate account report demand removal violation following applicable credit reporting law usc exercising right audit record claim verified credit bureau debt usc requires early warning notice notified said person placed credit report never received early warning notice relate inquiry hard inquiry need clear credit account immediately violate seriously following law usc miscellaneous reptg agency inquiry telephone company bank inquiry national credit card complete dept store inquiry bank inquiry jeweler inquiry bank inquiry auto financing miscellaneous reptg agency inquiry auto financing inquiry national credit card national credit card inquiry national credit card inquiry national credit card inquiry bank inquiry bank please investigate credit card collection account belong business late payment reported credit card also never sign contract collection agency conclude credit bureau intentionally put negative information credit collection agency account number contact information associated account credit report demand removed also see derogatory mark account info reported also accordance fcra disclosure investigative consumer report must receive disclosure letter received must made writing mailed otherwise delivered consumer later three day date report first requested also accordance fcra whenever consumer reporting agency prepares investigative consumer report adverse information consumer report information matter public record may included subsequent consumer report unless adverse information verified process making subsequent consumer report adverse information received within period preceding date subsequent report furnished writing mailed disclosure receipted credit bureau follow fcra law listed
credit_reporting,name trying report incorrect information credit account past year success see several hard inquiry exist account without notice inquiry inaccurate need removed credit account according recent credit report request several inaccurate account report demand removal violation following applicable credit reporting law usc exercising right audit record claim verified credit bureau debt usc requires early warning notice notified said person placed credit report never received early warning notice relate inquiry hard inquiry need clear credit account immediately violate seriously following law usc inquiry miscellaneous reptg agency inquiry telephone company inquiry bank xxxxxxxx inquiry national credit card inquiry complete dept store inquiry bank inquiry jeweler inquiry bank inquiry auto financing inquiry miscellaneous reptg agency inquiry auto financing inquiry national credit card inquiry national credit card xxxxxxxx inquiry national credit card inquiry national credit card inquiry bank inquiry bank please investigate credit card collection account belong business late payment reported credit card also never sign contract collection agency conclude credit bureau intentionally put negative information credit collection agency account number contact information associated account credit report demand removed also see derogatory mark account info reported also accordance fcra disclosure investigative consumer report must receive disclosure letter received must made writing mailed otherwise delivered consumer later three day date report first requested also accordance fcra whenever consumer reporting agency prepares investigative consumer report adverse information consumer report information matter public record may included subsequent consumer report unless adverse information verified process making subsequent consumer report adverse information received within period preceding date subsequent report furnished writing mailed disclosure receipted credit bureau follow fcra law listed
credit_reporting,whoever might read name trying fix incorrect information credit report several time seems nothing changed report figure address employment information false belong business see inaccurate information might really high risk effect business really hope would get fixed soon address employment information need removed credit report employment info address reported ga ga ga
credit_reporting,open credit card account target late fee reported bureau hurting credit also reporting balance incorrectly bureau
debt_collection,complaint update lvnv funding llc lvnv never contacted mail manner regarding debt purchase became aware existence filed lawsuit debt recognize guise litigation use cover avoid producing document requested documentation disputed account provide proof followed law properly necessary work prior filing lawsuit another across state line penny dollar purchased debt business computer software personal information another person create charge think owed thus account could fraudulent account fraudulent charge etc thus totality charge disputed debt buyer south carolina properly followed legal procedure prior initiating lawsuit individual across state line validated debt therefore complaint dismissed immediately see attached page new
